,Condition,System,Relative Risk (Spring),99.9% C.I. (Spring),Spring Significant?,Relative Risk (Autumn),99.9% C.I. (Autumn),Autumn Significant?
0,Aplastic and other anaemias|diseases of the blood and blood-forming organs and certain disorders involving the immune mechanism$M$21-40,diseases of the blood and blood-forming organs and certain disorders involving the immune mechanism,0.9443615655510031,"{'CI': array([0.90044709, 0.99405725]), 'Gelman-Rubin': 0.9999576075033247}",Yes,0.9703453549447127,"{'CI': array([0.91390255, 1.0327031 ]), 'Gelman-Rubin': 0.9999709199919985}",No
1,"Coagulation defects, purpura and other haemorrhagic conditions|diseases of the blood and blood-forming organs and certain disorders involving the immune mechanism$M$61-",diseases of the blood and blood-forming organs and certain disorders involving the immune mechanism,1.044598535576699,"{'CI': array([1.00418249, 1.08429859]), 'Gelman-Rubin': 0.9998620955977616}",Yes,0.9841332243098928,"{'CI': array([0.94376274, 1.02689722]), 'Gelman-Rubin': 1.0000569446696455}",No
2,Other forms of heart disease|diseases of the circulatory system$M$21-40,diseases of the circulatory system,0.9614520166665066,"{'CI': array([0.92426369, 0.9997012 ]), 'Gelman-Rubin': 0.9999217834633619}",Yes,1.0381056509479927,"{'CI': array([0.99759028, 1.08135052]), 'Gelman-Rubin': 0.9998370297156479}",No
3,"Disorders of gallbladder, biliary tract and pancreas|diseases of the digestive system$M$41-60",diseases of the digestive system,1.0270022524435363,"{'CI': array([1.00076115, 1.05359913]), 'Gelman-Rubin': 0.9997762022347582}",Yes,0.9919605335372663,"{'CI': array([0.96400215, 1.02005373]), 'Gelman-Rubin': 0.9997851581482726}",No
4,Hernia|diseases of the digestive system$F$61-,diseases of the digestive system,1.0491294598194547,"{'CI': array([1.0039054 , 1.09707334]), 'Gelman-Rubin': 0.999872815661445}",Yes,1.0072031291371804,"{'CI': array([0.95483747, 1.06041089]), 'Gelman-Rubin': 0.9998130567848901}",No
5,Noninfective enteritis and colitis|diseases of the digestive system$M$41-60,diseases of the digestive system,1.0435971098420163,"{'CI': array([1.01061911, 1.07540927]), 'Gelman-Rubin': 0.9998449700285935}",Yes,0.9773645103028606,"{'CI': array([0.94548655, 1.01240782]), 'Gelman-Rubin': 0.9999122781037153}",No
6,Other diseases of intestines|diseases of the digestive system$M$21-40,diseases of the digestive system,1.0491034870508205,"{'CI': array([1.00749894, 1.09204212]), 'Gelman-Rubin': 0.9999036809723625}",Yes,1.0106783792520657,"{'CI': array([0.96020756, 1.05780633]), 'Gelman-Rubin': 0.9999018897615586}",No
7,Other diseases of intestines|diseases of the digestive system$M$41-60,diseases of the digestive system,1.0238823096505234,"{'CI': array([1.00094655, 1.04715092]), 'Gelman-Rubin': 0.9997830560087752}",Yes,0.9809449767556546,"{'CI': array([0.95411135, 1.00710647]), 'Gelman-Rubin': 0.9999208160613527}",No
8,"Noninflammatory disorders of female genital tract|diseases of the genitourinary system: pelvis, genitals and breasts$F$41-60","diseases of the genitourinary system: pelvis, genitals and breasts",0.9677610157180849,"{'CI': array([0.94350608, 0.99233498]), 'Gelman-Rubin': 0.999800959373228}",Yes,0.9809112573967149,"{'CI': array([0.95497951, 1.00771401]), 'Gelman-Rubin': 0.9998194292895837}",No
9,Other diseases of urinary system|diseases of the genitourinary system: urinary system$M$41-60,diseases of the genitourinary system: urinary system,1.048432286215636,"{'CI': array([1.00079212, 1.09884942]), 'Gelman-Rubin': 1.0002794735577611}",Yes,0.9792387476962667,"{'CI': array([0.92853862, 1.02785867]), 'Gelman-Rubin': 0.9998997808313196}",No
10,Arthrosis|diseases of the musculoskeletal system and connective tissue$F$41-60,diseases of the musculoskeletal system and connective tissue,1.0340334192359235,"{'CI': array([1.00342008, 1.06306824]), 'Gelman-Rubin': 0.9998749427137026}",Yes,0.9779979377450685,"{'CI': array([0.95110464, 1.0078047 ]), 'Gelman-Rubin': 0.9998046153904416}",No
11,Other diseases of pleura|diseases of the respiratory system$M$41-60,diseases of the respiratory system,1.0533932478376302,"{'CI': array([1.01582051, 1.08524647]), 'Gelman-Rubin': 0.999976017316793}",Yes,0.997033957918275,"{'CI': array([0.96465023, 1.03191102]), 'Gelman-Rubin': 0.9998466569400773}",No
12,Other diseases of the respiratory system|diseases of the respiratory system$F$61-,diseases of the respiratory system,1.0154953532765005,"{'CI': array([1.00014731, 1.0341521 ]), 'Gelman-Rubin': 0.9997972626703452}",Yes,0.9883675339966924,"{'CI': array([0.97101407, 1.0052403 ]), 'Gelman-Rubin': 0.9997820916636457}",No
13,Infections of the skin and subcutaneous tissue|diseases of the skin and subcutaneous tissue$M$41-60,diseases of the skin and subcutaneous tissue,0.9692240065479927,"{'CI': array([0.94224563, 0.9976414 ]), 'Gelman-Rubin': 0.9999004069397627}",Yes,0.9881739763564148,"{'CI': array([0.96053482, 1.01769006]), 'Gelman-Rubin': 1.0002300631813943}",No
14,Persons encountering health services for examination and investigation|external causes of morbidity and mortality$F$41-60,external causes of morbidity and mortality,0.9577143722096418,"{'CI': array([0.92175809, 0.99220161]), 'Gelman-Rubin': 1.0001178068176517}",Yes,1.0234709914558424,"{'CI': array([0.98048286, 1.06278537]), 'Gelman-Rubin': 0.9999151910049922}",No
15,Persons with potential health hazards related to family and personal history and certain conditions influencing health status|external causes of morbidity and mortality$M$41-60,external causes of morbidity and mortality,1.0252253847625206,"{'CI': array([1.00016734, 1.05138884]), 'Gelman-Rubin': 0.9997918183710137}",Yes,0.9848084575639665,"{'CI': array([0.95928743, 1.0086567 ]), 'Gelman-Rubin': 0.9997789512932642}",No
16,Persons with potential health hazards related to family and personal history and certain conditions influencing health status|external causes of morbidity and mortality$M$61-,external causes of morbidity and mortality,1.0333233226469014,"{'CI': array([1.01205725, 1.05507033]), 'Gelman-Rubin': 0.9998323175123117}",Yes,0.987280836555825,"{'CI': array([0.96431228, 1.01005092]), 'Gelman-Rubin': 1.0001511467095734}",No
17,Elbow and forearm|injury$F$41-60,injury,0.9294895015704601,"{'CI': array([0.86729967, 0.99038981]), 'Gelman-Rubin': 0.9999133186373108}",Yes,1.0251728809267406,"{'CI': array([0.94661847, 1.11258156]), 'Gelman-Rubin': 0.9998714713628948}",No
18,Head|injury$M$0-10,injury,0.929233724461354,"{'CI': array([0.86761962, 0.99186006]), 'Gelman-Rubin': 1.0000769280037987}",Yes,0.9542088852944013,"{'CI': array([0.87418624, 1.02920613]), 'Gelman-Rubin': 0.9997917676835935}",No
19,Other metabolic disorders|metabolic diseases$M$61-,metabolic diseases,1.0197513397257845,"{'CI': array([1.00133229, 1.0379871 ]), 'Gelman-Rubin': 0.9998316564900793}",Yes,0.9927973776716797,"{'CI': array([0.97291889, 1.0120739 ]), 'Gelman-Rubin': 0.9997997216670101}",No
20,"Malignant neoplasms, respiratory system and intrathoracic organs|neoplasms$M$61-",neoplasms,0.9577378022866346,"{'CI': array([0.92596204, 0.98938445]), 'Gelman-Rubin': 1.0000355315350946}",Yes,1.016831065620164,"{'CI': array([0.97423467, 1.05620689]), 'Gelman-Rubin': 0.9999670408554053}",No
21,"Complications of surgical and medical care, not elsewhere classified|poisoning and certain other consequences of external causes$F$61-",poisoning and certain other consequences of external causes,1.0383818720610878,"{'CI': array([1.00724563, 1.07352304]), 'Gelman-Rubin': 0.9998746312791529}",Yes,0.9855842908940823,"{'CI': array([0.95034167, 1.02001385]), 'Gelman-Rubin': 0.9998638215443696}",No
22,"Complications of labour and delivery|pregnancy, childbirth and the puerperium$F$11-20","pregnancy, childbirth and the puerperium",1.045599551227876,"{'CI': array([1.00046096, 1.09005804]), 'Gelman-Rubin': 0.9997630151893526}",Yes,0.9855643306177658,"{'CI': array([0.93664371, 1.03264979]), 'Gelman-Rubin': 0.9999433966544716}",No
23,"Bacterial, viral and other infectious agents|sequelae, and diseases classified elsewhere$F$61-","sequelae, and diseases classified elsewhere",1.0462560505810483,"{'CI': array([1.00783344, 1.08937553]), 'Gelman-Rubin': 0.9997731073137689}",Yes,1.004847790783802,"{'CI': array([0.96304742, 1.05196358]), 'Gelman-Rubin': 1.0000404103011515}",No
24,Nervous and musculoskeletal systems|symptoms and signs$M$61-,symptoms and signs,0.9531267572113258,"{'CI': array([0.91391654, 0.99025274]), 'Gelman-Rubin': 0.9997897272836958}",Yes,1.0108693051562692,"{'CI': array([0.96699416, 1.05507422]), 'Gelman-Rubin': 1.0000048635864622}",No
25,Urinary system|symptoms and signs$M$61-,symptoms and signs,1.0478828889570868,"{'CI': array([1.01184434, 1.08179313]), 'Gelman-Rubin': 0.9999791986612749}",Yes,0.9938755752630457,"{'CI': array([0.95721424, 1.03048662]), 'Gelman-Rubin': 0.9998937639027671}",No
